
<!ELEMENT CATALOGO (PLANTA*)>
<!ELEMENT PLANTA (IDENTIFICADOR,DATOS?)>
<!ELEMENT IDENTIFICADOR (#PCDATA)>
<!ELEMENT DATOS (ZONA,ILUMINACION*,PRECIO,CODIGO)  >
<!ELEMENT ZONA (#PCDATA)>
<!ELEMENT ILUMINACION (#PCDATA)>
<!ELEMENT PRECIO (#PCDATA)>
<!ELEMENT CODIGO (#PCDATA)>
<!ATTLIST IDENTIFICADOR IDIOMA (INGLÉS | ESPAÑOL) #REQUIRED>
<!ATTLIST DATOS GRUPO_BOTANICO CDATA #IMPLIED>